,Name,PlantType,Color,HardinessZones,BloomsIn,Height,SunNeeds,WaterNeeds,Maintenance
193,Taraxacum (Dandelion),Perennials,"The flowers are usually bright yellow, but they can be darker or even white, such as Taraxacum albidum.",3-10,"Spring, Autumn, Winter, Summer",Dandelions range in height from 5 to 50 cm (2-20 inches) in height.,"Full sun, Partial sun",avarage,low
194,Tigridia (Tiger Flower; Mexican Shellflower),Bulbs,"The flowers may be red, yellow, white, cream, orange, scarlet, pink and mauve.",8-11,Summer,These plants usually grow between 30 and 60 cm (1-2 ft) tall.,"Full sun, Partial sun",avarage,low
195,Torenia (Wishbone Flower; Bluewings; Clown Flower),Annuals,"The flowers come in shades of purple, blue, pink, yellow and white.",2-11,"Spring, Autumn, Summer",Torenia grows up to 30 cm (1 ft) in height.,"Partial sun, Shade",avarage,medium
196,Tradescantia (Spiderwort),Perennials,"The flowers come in shades of blue, purple, pink, red and white.",4-12,"Spring, Autumn, Summer",This plant can reach up to 90 cm in height.,"Full sun, Partial sun, Shade",avarage,low
197,Tricyrtis (Toad Lily),Perennials,"The flowers come in shades of red, purple, white and yellow.",4-9,"Autumn, Summer",Tricyrtis reaches up to 90 cm (3 ft) in height.,"Partial sun, Shade",avarage,low
198,Trillium (Wake Robins; Birthroot),Perennials,"Flower color varies from red, pink, maroon and purple to yellow and white.",3-9,"Spring, Summer",Trillium usually grows between 30 and 60 cm (1-2 ft) in height.,"Partial sun, Shade",avarage,low
199,Trollius (Globe Flower),Perennials,"These beautiful flowers bloom in shades of yellow, orange and white.",3-8,"Spring, Summer",Trollius can grow up to 90 cm (3 ft) in height.,"Full sun, Partial sun",avarage,low
200,Tropaeolum (Nasturtium),"Annuals, Perennials","Nasturtium comes in red, orange, yellow, purple and cream colors.",2-11,"Spring, Autumn, Summer","Nasturtium vary in height from 20 cm (8 inches) to 3 metres (10 ft), depending on species.",Full sun,avarage,low
201,Tulipa (Tulip),"Annuals, Bulbs, Perennials",You will find Tulips in nearly every color and pattern.,3-9,Spring,"Tulips can be short (less than 20 cm or 8 inches), medium (20-45 cm or 8-18 inches) and tall (greater than 45 cm or 18 inches).","Full sun, Partial sun",low,low
202,Ulex (Gorse; Furze),Shrubs,The flowers are usually yellow in color.,6-10,"Spring, Autumn, Winter, Summer",The plant can grow up to 3 metres (10 ft) high.,Full sun,low,low
203,Ursinia (African Daisy),"Annuals, Perennials","Ursinia has yellow, red or orange flowers.",3-11,"Spring, Autumn, Winter, Summer",Ursinia grows from 20 cm to 60 cm (8 inches to 2 ft) in height.,"Full sun, Partial sun",avarage,low
204,Valeriana (Valerian),Perennials,"The flowers are white, pink or lavender.",4-9,"Autumn, Summer","The plant can reach 1,5 meters (5 ft) in height.","Full sun, Partial sun",avarage,low
205,Verbascum (Mullein),"Annuals, Perennials","These flowers are primarily bright yellow, but also white, red, purple and pink.",5-10,"Spring, Summer",Mullein has a flower spike that reaches 3 metres (10 ft) high.,Full sun,low,low
206,Verbena (Vervain),"Annuals, Perennials","The blooms come in shades of purple, red, pink and white.",3-12,"Autumn, Summer","Verbena grows from 7 cm to 180 cm (3 inches to 6 ft) tall, depending on species.","Full sun, Partial sun",avarage,low
207,Veronica (Speedwell),Perennials,"Veronica comes in shades of blue, purple, pink and white.",3-11,"Spring, Autumn, Summer","Veronica comes in a wide range of sizes, from dwarfs that rarely exceed 10 cm (4 inches) to large specimens that can grow more than 1,5 metres (5 ft) in height.","Full sun, Partial sun",avarage,low
208,Veronicastrum (Veronicastrum),Perennials,"The flowers come in shades of white, purple and pink.",3-9,"Autumn, Summer",Veronicastrum reaches nearly 2 m (6 ft) in height.,"Full sun, Partial sun",avarage,low
209,Vinca (Periwinkle),"Perennials, Shrubs","Vinca comes in shades of pink, purple, red and white.",3-11,"Autumn, Summer",Vinca range in size from dwarf species that grow only about 10 cm (4 inches) tall to the larger types which can grow up to 60 cm (2 ft) in height.,"Full sun, Partial sun, Shade",avarage,low
210,Viola (Violet),"Annuals, Perennials, Shrubs","As their name suggests, many species are violet in color, but can also be blue, white, yellow and cream. Some blooms have two or even three colors.",3-9,"Spring, Autumn, Winter, Summer",Violas are small plants up to 20 cm (8 inches) tall.,"Full sun, Partial sun",avarage,low
211,Watsonia (Bugle Lily),"Bulbs, Perennials","The flowers come in shades of red, pink, orange, purple and white.",8-11,"Spring, Autumn, Winter, Summer",This plant grows from 30 cm to 2 metres (1 ft to 7 ft) in height.,Full sun,avarage,low
212,Weigela (Weigela),Shrubs,"The flowers come in shades of red, pink, white and yellow.",4-9,"Spring, Autumn, Summer",This plant grows from 30 cm (1 ft) to 3 metres (10 ft) high.,"Full sun, Partial sun",avarage,low
213,Wisteria (Wisteria),Climbers,"Wisteria comes in shades of white, blue, purple and pink.",5-9,"Spring, Summer","Wisteria grows from 180 cm to 12 metres (6 to 40 ft) tall, depending on species.","Full sun, Partial sun",avarage,hard
214,Xanthisma (Xanthisma),"Annuals, Perennials","The flowers are generally yellow in color, but there are also varieties that are white and purple.",3-9,"Spring, Autumn, Winter, Summer",This plant can reach a height of 60 cm (2 ft).,"Full sun, Partial sun",low,low
215,Xeranthemum (Xeranthemum),Annuals,"These flowers come in shades of pink, purple and white.",2-10,"Autumn, Summer",This plant can grow between 30 and 90 cm (1-3 ft) tall.,Full sun,avarage,low
216,Xerochrysum (Xerochrysum),"Annuals, Perennials, Shrubs","Its bracts are yellow, orange, purple, pink and red.",8-11,"Spring, Autumn, Summer","Xerochrysum grows from 20 to 150 cm (8 inches to 5 ft) tall, depending on species.",Full sun,avarage,low
217,Xerophyllum (Xerophyllum),"Herbs, Perennials",Xerophyllum has unique cream-colored flowers.,4-8,"Spring, Summer","These plants can grow from 50 cm to 1,5 meters (2-5 ft) tall, with numerous small flowers growing on long flower stalks.","Full sun, Partial sun",low,low
218,Yucca (Yucca),"Cactus - Succulents, Shrubs, Trees","The Yucca plant has green, sword-like leaves and white or whitish flowers.",4-11,"Spring, Autumn, Summer","Yucca grows from 60 cm to 4,5 metres (2 to 15 ft) high, depending on species.","Full sun, Partial sun",low,low
219,Zantedeschia (Calla Lily; Arum Lily),"Bulbs, Perennials","Zantedeschia is available in a multitude of colors including white, yellow, orange, pink, purple and even black.",3-10,"Spring, Summer",The plant grows between 30 and 90 cm (1 to 3 ft) tall.,"Full sun, Partial sun",avarage,low
220,Zephyranthes (Rain Lily; Fairy Lily),"Annuals, Bulbs, Perennials","The flowers may be yellow, pink and white.",7-11,"Spring, Autumn, Summer",The plant can grow up to 30 cm (1 ft) in height.,"Full sun, Partial sun",avarage,medium
221,Zinnia (Zinnia),"Annuals, Perennials, Shrubs","These flowers are known for their vivid colors. They are often multi-colored and may be yellow, orange, white, red, pink and purple.",2-11,"Autumn, Summer",Zinnias range in size from dwarf species that only grow 17 cm (7 inches) high to vigorous types over 120 cm (4 ft) tall.,Full sun,avarage,low
222,Zygopetalum (Zygo),"Annuals, Perennials","Zygopetalum has unusually colored flowers in shades of blue, purple, red and white.",9-11,"Spring, Autumn, Winter",Zygopetalum usually grows to a height of 40 cm (16 inches).,"Full sun, Partial sun",avarage,medium
